{
  "key": "teleportation-technique",
  "name": "Teleportation Technique",
  "className": "Scout",
  "casterType": "none",
  "casterRatio": 0,
  "classCasterType": "tech",
  "description": "Whether through experimentation or discovery of an ancient technology, followers of the Teleportation Technique have learned to create brief teleportation portals, allowing them to maneuver and attack both quickly and unpredictably throughout the battlefield.\n\n### Bonus Proficiencies\n_**Teleportation Technique:** 3rd level_\nYou gain proficiency in tinker's implements.\n\n### Personal Teleporter\n_**Teleportation Technique:** 3rd, 5th, 9th, 13th, 17th, and 20th level_\nYou can use portable teleporters as a bonus action, instead of an action.\n\nAdditionally, while you are wielding a tech focus, you can use your bonus action to create a pair of linked portals: one portal appears in a space within 5 feet of you, and the other portal appears in an unoccupied space you can see up to 30 feet away. These portals last until the start of your next turn, and they are large enough to accommodate Medium and smaller creatures and objects. Portals take the appearance of an elongated, shimmering mirror, and looking through a portal, a creature can see through the linked portal as if looking through a window. A creature or object who passes through a portal immediately appears in a space within 5 feet of the linked portal. You can use your reaction to end your portals early. If a creature is partially within your portals, it is shunted back to the space it previously occupied and it must make a Dexterity saving throw against your a tech save DC. On a failed save, it takes energy damage equal to your scout level + your Intelligence modifier. You can use this feature twice. You gain an additional use at 5th, 9th, 13th, and 17th level. You regain all expended uses when you complete a short or long rest. At the beginning of each of your turns while you have a pair of portals active, you can expend a use of this feature to extend the duration of the portals until the start of your next turn (no action required). The distance at which you can create portals increases at higher levels. It increases to 60 feet at 5th level, 90 feet at 9th level, 150 feet at 13th level, 300 feet at 17th level, and 1,000 feet at 20th level.\n\n### Mark of the Teleporter\n_**Teleportation Technique:** 3rd level_\nOn your turn, when you deal damage to the target of your Ranger's Quarry, and either you, your weapon, or the source of your damage have passed through your portals on this turn, when you roll below half the maximum on a damage die, you can treat the roll as if you'd rolled half the maximum on the damage die. You can only affect a number of dice up to half your Intelligence modifier (minimum of one) in this way.\n\n### Residual Warp\n_**Teleportation Technique:** 7th level_\nWhen you use your Personal Teleporter feature, you can place your portal in a place you've visited in the last 10 minutes, provided you can remember it, as opposed to a place you can see. That place must still be within range of your teleporter.\n\n### Quantum Entanglement\n_**Teleportation Technique:** 11th level_\nWhen you use your Personal Teleporter feature, you can place the portal that you would normally place within 5 feet of you in a place you can see within your Personal Teleporter's range. If that space is occupied by a Huge or smaller creature or a Medium or smaller unsecured object, it must make a Dexterity saving throw against your tech save DC. An object automatically fails this saving throw, and a creature can choose to fail. On a failed save, a Medium or smaller creature or object falls through the portal, immediately appearing in a space within 5 feet of the linked portal and falling prone. A Large or Huge creature instead falls prone without moving.\n\n### Reprisal\n_**Teleportation Technique:** 15th level_\nWhen you would be affected by a weapon or tech power that requires a Dexterity saving throw or attack roll and would affect only you, you can use your reaction to instantaneously create a pair of portals to redirect that power to another target within 30 feet. If the weapon or power required a melee or ranged attack roll, make a melee or ranged tech attack roll against the new target, as appropriate. If it required a Dexterity saving throw, the new target must make a Dexterity saving throw against your tech save DC.\n\nOnce you've used this feature, you must complete a short or long rest before you can use it again.",
  "sourceKey": "ec",
  "contentSet": "expanded-content"
}
